"publishedDate","lang","publishedPlatform","title","locationId","travelDate","tripType","rating","text"
"2023-04-03","en","MOBILE","Amazing food","1089531","2023-02","FRIENDS","5","If you want authentic Moldovan food this is a place to go. We didn’t even had problem ordering with waiter even though we don’t speak romanian and they don’t speak english because the menu had photos of the dishes which was great for us. The food was delicious and i we were so upset we couldn’t fit anymore in our stomachs as the whole menu looked so amazing and I’d love to try everything."
"2023-03-18","fr","OTHER","Aucun intérêt","1089531","2023-03","NONE","2","A part une certaine rapidité dans le service, le reste n'est pas au rendez-vous, ce qui pour un lieu où vous venez normalement manger quelque chose de savoureux est bien regrettable. C'est assez insipide, et plus précisément pour la soupe c'est pas franchement top, le choux farci est farci d'une viande qui semble rance, et la galette de pomme de terre avait le goût d'une vieille huile de friture. Le retour à la maison s'est soldé par un séjour direct aux toilettes. Donc très déçu, et quelques sourires et mots avenants seraient les bienvenus. Et pour finir, ne pas rendre la monnaie, ou plutôt mettre tellement de temps pour le faire est franchement limite. Je suis toujours enclin à laisser un pourboire mais je trouve insupportable que se soit par défaut et surtout au bon vouloir des serveurs surtout que le restaurant était à 30% plein, donc pas du tout débordé par le service."
"2023-02-19","en","MOBILE","Authentic Moldovan Cusine,Fast service,tasty, affordable.","1089531","2023-02","SOLO","5","For authentic Moldovan Cuisine in Chisinau.Travelling people like me always love to taste traditional local food,this place delivers it.

La Placinte is a chain and many of them in Chisinau.
Great tasting food,fast service,very polite waiters, separate play area for children on one side (very safe), parents can watch kids while they eat.

Also they have a bakery style setup in the middle where you can buy things for home.

Cons: Very hard to find parking in the street, better if you come without a car.

Note to the owner:Security guy at the entrance was rude for taking pictures from the street ,May be he needs little more training to interact with customers.
"
"2023-01-13","it","OTHER","Pranzo di lavoro","1089531","2022-12","NONE","4","è una  catena e  una  sicurezza per chi vuole  mangiare  bene, tipico e particolare. al di la dei piatti che possono piacere  o non piacere  per  gli ingredienti , il tutto è fatto con bravura e  il locale  è molto informale  oltre  pulito"
"2023-01-11","ru","MOBILE","Ездили  из Одессы в Кишинев по делам, зашли позавтракать. Остались довольны","1089531","2023-01","FRIENDS","5","Я выросла на Бессарабии и молдавская кухня  мне знакома. Совнарком про сеть Лаплацында от друзей. Было время до рейса на самолет и мы с друзьями зашли покушать. Приятно удивлены были ценами. Люто дальности заказали несколько блюд и одну плацынду с сыром. Было очень вкусно, хумус, салат свекла с черносливом,  мамалыга, были на высоте. На плацынду не было сил, но мы ее съели. Купили домой в Одессу 7 плацынд угостить родственников. Ресторанчик супер, будете в Кишиневе обязательно посетите. Рекомендую."
"2022-11-15","ru","MOBILE","Вкусное место","1089531","2022-11","FAMILY","5","Очень атмосферное место) Вкусно и быстро!
Традиционные блюда простые и сытные, добротные порции! Вкусное напитки не разбавленные! Рекомендуем!"
"2022-11-11","it","MOBILE","Riatorante moldavo top","1089531","2022-11","COUPLES","5","In viaggio a Chișinău per un compleanno. La mia compagna nativa del luogo decide di andare in questo ristorante e fa bene!!!
Tutto molto buono, ristorante molto curato e caratteristico! 
Da provare la placinte, una sorte di piadina ripiena molto buona!

Consigliare e d obbligo"
"2022-10-10","en","MOBILE","Local cuisine very good food and price","1089531","2022-10","COUPLES","5","Excellent restaurant,  the service was quick, the food was very good.
The dishes were varied and we tasted 6 of them between the four of us, all were very good.
The tea and local fruit drink was refreshing.
Overall I am planning to visit there again before heading home."
"2022-09-19","en","MOBILE","Good for family but not only ","1089531","2022-09","FAMILY","4","Like usual, many dishes to choose,  not only local and of course many types of pies. The service was quick and the personal nice"
"2022-07-19","ru","OTHER","Хорошо и колоритно","1089531","2022-07","NONE","4","Хорошая локальная кухня, приятная цена. Брал котлеты с пюре, но даже такое скучное блюдо тут на высоком уровне. Плацинды стоит попробовать каждому. Правда довольно высокое требование для бесплатной доставки 350 леев, это выше чем у всех."
"2022-07-08","en","MOBILE","Good food, great ambiance","1089531","2022-07","FRIENDS","5","Was highly recommended by friends due to the food, ambiance and service, and did not disappoint! Food was lovely, portions decent and price was very reasonable. The Mamaliga dish was the best - will definitely return!"
"2022-06-30","en","MOBILE","Very good","1089531","2022-06","COUPLES","5","It is similar to Andy's I was told this is because same owner however Placinte has more traditional foods. 
It was very good. The service was great. 
A placinte it's like a fried tortilla item reminds me of a quesadilla a bit. 10/10
Chicken in white sauce 10/10
Sarmale de Casa 10/10 

Their kitchen is on point super delicious food."
"2022-06-19","it","MOBILE","Soddisfatto ","1089531","2022-06","SOLO","5","Sono stato ad un ristorante diverso ma della stessa catena.
Specialità rumene e moldave,cibo semplice,gustoso e sano,hanno diversi menù anche per ciliaci e vegani.
I prezzi sono vantaggiosi per gli occidentali,spesa media di un pasto 10 euro tuttavia se si vuole ordinare solo una zuppa (ottima) si spende poco più di due euro.
Consiglio la visita"
"2022-06-13","en","MOBILE","O duminică după-amiază extraordinară în familie
A great Sunday afternoon with the family","1089531","2022-06","FAMILY","5","We were very hungry and thirsty and went to the La Placinte restaurant on Pushkin Street. We were served very quickly. We enjoyed the tastiest traditional food in Chisinau! The compote reminded us of the taste of childhood! The young lady who served us was very kind and receptive to our wishes. Thanks a lot!"
"2019-07-16","fr","MOBILE","Meilleur steak à Chişinău ! ","9729405","2019-07","COUPLES","5","En revenant d’Allemagne, nous avons eu envie d’un bon steak et chez Osho, c’était le meilleur choix possible. Petit restaurant confortable , repas délicieux et personnel très aimable !!!"
"2019-07-04","ru","MOBILE","Тихие переговоры!!","9729405","2019-07","BUSINESS","5","Здесь можно не только встретится со своими деловыми партнёрами, но и покушать вместе с семьёй или с друзьями. Здесь всегда очень вкусно и каждый месяц добавляют несколько блюд и десертов. Ещё здесь добрый персонал и приятная атмосфера!!"
"2019-06-06","es","OTHER","Animado y buen servicio","9729405","2019-06","FRIENDS","4","Está un poco alejado del centro. La calidad de los platos es muy buena, sobre todo la carne. Muy bonito decorado. Calidad- precio muy barato, sobre todo las bebidas."
"2019-05-28","en","MOBILE","Perfekt ambiente, meal and atmosphere ","9729405","2019-05","BUSINESS","5","Upto now I found no better restaurant in Chisinau. Every time a good experience. Good style, good food, friendly employees, very nice design "
"2019-05-24","ru","MOBILE","Отличный ресторан","9729405","2019-05","FRIENDS","5","Я бы всем посоветовала этот великолепный ресторан. Прекрасная атмосфера. Очень красиво и вкусно. Подходит почти для всех праздников. Кухня великолепная. Разнообразие коктейлей, супер апероль с маракуйей. "
"2019-04-09","en","OTHER","A disappointing dining experience","9729405","2019-04","COUPLES","2","Based on the fact the menu and website looked very impressive we decided to have dinner at Osho. The restaurant is modern and looks fancy. 
Then we sat down in a booth. The first thing you notice is that the seat is too low and table too high. We ordered starters and main courses. I was surprised to find roast potatoes as part of a herring starter but I guess that's the chef's prerogative
We were not even half way through our starters, when the waiter brought the main dishes and seeing we were nowhere near ready for them, nonetheless set them down, lifted off the covers which would have at least kept them a little warm and walked off. After choking down the remainder of our starters, hoping the main course would still be warm, we discovered it wasn't really worth it. My veal chops were ordered medium but cooked well done, they were tough with little taste and served in a large bowl instead of a plate which made it very difficult to cut without knocking over the whole dish. The dish said it comes with mushrooms which turned out to be tiny slivers of deep fried mushrooms . drenched in oil,which at first I thought were deep friend onions. My wife's fish was average but not more than that. The service was clumsy coupled with the significant issue of plating the main courses and serving them way too early.
All in all, what began as a promising evening was very disappointing. Will not be returning.
."
"2019-03-07","en","MOBILE","Nice place","9729405","2018-11","COUPLES","5","The cuisine is nice. I think the service could be better considering the price. Generally speaking though it's a great restaurant"
"2018-12-16","ru","MOBILE","Превосходная кухны","9729405","2018-10","FAMILY","5","Osho это один из немногих хороших ресторанов, с потрясающей кухней, стильным интерьером и дружелюбных персоналом. 
Каждый раз уходя, есть желание вернуться вновь! 

Цены супер! А завтраки вообще отпад❤️ 

Всем советую! "
"2018-11-06","ru","MOBILE","Кроме отличного мяса... Отличный чай! ","9729405","2018-11","FRIENDS","5","Выбирал место для быстрой встречи по работе и решил выбрать этот ресторан, и, скажу я вам, что чай здесь отличный! "
"2018-11-03","fr","MOBILE","Magnifique endrout","9729405","2018-11","NONE","4","Très bel endroit décoré avec beaucoup de goût. Les plats sont délicieux et servis avec soins. Tout est pensé dans les moindres détails. À faire "
"2018-11-03","fr","MOBILE","Superbe endroit","9729405","2018-11","FRIENDS","4","L’endroit est vraiment décoré avec beaucoup de goût.
Service dispo et professionnel.
Les plats y sont présentés avec beaucoup d’attention et les saveurs sont là !
J’ai personnellement essayer le Ribeye d’Australie.. très bonne viande !
Essayez les vins locaux.. bluffants."
"2018-10-28","en","MOBILE","Amazing dinner on Friday night","9729405","2018-10","COUPLES","5","Had an amazing Friday night dinner at osho restaurant in chisinau ( Moldova ) trendy fancy restaurant , it’s better to make a reservation in advance ) great food and atmosphere friendly waitress and the serves is amazing . Prices r more than fair for that kind of restaurant. it’s a place u surly want to visit , u will not be disappointed ( don’t forget to taste the amazing local Moldavian wine !! - I think it was 215 lei -( 11 euro/ 12 dollars ) for a 750ml bottle ) u would want another one !
Thank u osho restaurant for a great night "
"2018-10-25","en","MOBILE","Excellent food, good wines and service","9729405","2018-10","BUSINESS","5","Very nice location, fancy and cosy. Goos for any type or reunion: family, friends, clients, coworkers. Very good live music"
"2018-10-25","ru","MOBILE","Один из лучших в Кишиневе.","9729405","2018-10","COUPLES","5","Удобное месторасположение, есть парковка. Летом работает терраса. 
Подача и вкус блюд однозначно радуют. Очень вкусно. Обслуживание хорошее. 
По атмосфере тоже очень нравится.
Отличное место провести вечер."
"2018-10-11","en","MOBILE","Tasty cousine and fancy atmosphere","9729405","2018-09","COUPLES","5","Absolutely delicious cousine!!!! I enjoy being there, the atmosphere, design, the waiters, they all make a restaurant to want to come back again. 
The only thing i don’t like is about the terrace area, for me there’s too cold ))"
"2018-09-25","ru","MOBILE","Минус","9729405","2018-09","COUPLES","2","Неплохая в целом идея, хорошее месторасположение и наиглупейшее ощущения дискомфорта, когда в абсолютно пустом заведении тебя сажают не туда куда ты просишь, а туда где сочтёт нужным халдей), сославшись на якобы резерв. Первое желание было уйти, но я решил все таки поужинать и посмотреть «резерв», по итогу, как и ожидалось три резервных стола в течении 2 часов никто не занял. Назовитесь закрытым клубом что ли, чтоб народ не задавал вопросов."
"2018-09-10","ru","OTHER","Ужин в кругу семьи","9729405","2018-08","FAMILY","5","Новый комфортный ресторан. Современный в стиле минимализма дизайн зала. Ничего лишнего, что обычно присутствует во многих ресторанах. Человек приходит отдохнуть и вкусно покушать - этого придерживаются хозяева ресторана и это им удалось. Блюда вкусно приготовлены и изыскано подаются."
"2018-08-15","en","MOBILE","Awesome kitchen ","9729405","2018-08","FAMILY","5","The service is a really good one. Also the food is one of the most delicious i ever ate. They have a great restaurant, too bad that it has a bad position but it's still one of the best ones. "
"2018-07-11","ru","OTHER","лучшее место в Кишиневе","9729405","2018-07","COUPLES","5","отличное стильное место приятное взору и также изысканному вкусу.очень впечатлил очень вкусный и сочный  ""Черный"" стейк из телятины на пюре из корнеплодов посыпанный невероятно вкусной гречкой,отличный соус и сочетание специй... и подача все на высшем уровне. Прекрасно оформленный комплимент из фруктов от заведения.Приятная атмосфера..."
"2018-06-28","en","MOBILE","Very nice","9729405","2018-06","FRIENDS","5","Great food, great wine, great live ambiental music, great service, very modern decor. A bit pricey, but I would surely go back!"
"2019-03-20","en","OTHER","Family party for colleagues","12794044","2018-12","NONE","4","Delicious Georgian cuisine and best hachapuri. Here you can try chacha and real Georgian wine. Very silent and cosy place."
"2019-02-12","en","MOBILE","Excellent restaurant","12794044","2019-02","FRIENDS","5","I highly recommend this restaurant for georgian food lovers. Cuisine is very good and tasty. Here you can find best hachapuri from Chisinau. Also i recommend to taste their local red and white wines. All i tasted here I really like it. Recommend this restaurant for any occasion."
"2018-03-04","ru","OTHER","Прекрасное место. превосходная кухня","12794044","2018-02","FAMILY","5","Очень часто посещаю этот ресторан как с семьей так и друзьями. Ни разу не пожалел, что остановил выбор на этом заведении. Приятная грузинская музыка не броский интерьер создают атмосферу уюта. Обслуживание выше всяких похвал. Но самое главное это кухня. Все очень вкусно приготовлено так как должно быть. Хинкали и шашлык из телятины это песня.Очень достойное заведение в которое не стыдно пригласить."
"2019-06-19","en","MOBILE","Super Oriental Fusion food ","9593555","2019-05","BUSINESS","5","Fantastic choice of food and wine including sushi and other warm delicacies when in Chisinau give it a try. I think the photos will show you the superb quality which this restaurant serves."
"2019-05-31","es","MOBILE","Sitio muy chulo","9593555","2019-05","FRIENDS","5","Está en el rooftop del hotel radisson. Buenas vistas y buena música. Personal muy amable. Bien de precio pero caro para ser Moldavia. Lo mejor la carne."
"2019-05-21","en","OTHER","Excellent Wine Selection","9593555","2019-05","FRIENDS","4","The service was fantastic and the food was tasty. They have a nice wine selection. The prices are a little high. I don't like that smoking is allowed- I have to shower before bed and wash my clothes immediately. For this reason, I won't return, but if you're a smoker, you'll fit right in."
"2019-05-14","en","OTHER","Great roof top bar","9593555","2019-05","FRIENDS","5","International roof top bar and restaurant. Great food and good drinks. Not the best sushi but decent.Up market prices in Chisinau. Absolutely fantastic view over the city. Some evenings live music. Great party mood late evenings at weekends. Perfect placeto come and watch the crowd. A lot of expats on weekends. International feeling."
"2019-05-01","es","MOBILE","Volveré","9593555","2019-04","SOLO","4","Muy buena cocina. Excelente vista de la ciudad. Lindo ambiente. Atención satisfactoria. Precios alineados con la calidad."
"2019-04-28","en","MOBILE","Good quality but comparatively expensive","9593555","2019-04","BUSINESS","3","It was one of the most expensive places I visited in Chisinau. That being said, the food and service were both very good. I ordered a tuna steak that was delicious. For desert a molten chocolate cake which was also very good. The salmon tartare and ceviche are also recommended. "
"2019-04-27","en","OTHER","Best cocktails in Chisinau...?","9593555","2019-04","FRIENDS","5","To be fair, Chisinau doesn't have much of a skyline to brag about, but whet there is, this place has the best view of. There's a nice little table in the corner where you can get a good view of the circus building which is better seen from that angle. Bit expensive for Chisinau standards but a bargain for the great service, great food and great cocktails...."
"2019-04-24","en","MOBILE","On the top of Chișinău","9593555","2019-04","BUSINESS","5","If you wanna see Chisinau from above, just to have a drink or coffee and to smoke or not a cigarette and of course if you wanna taste a special menu, you find can discover this great location. Fine dinning and very nice and friendly staff with an excellent service, will make you happy :) enjoy it!"
"2019-04-20","ru","OTHER","Тусовочное место в центре с видом.","9593555","2019-04","BUSINESS","5","На верхнем этаже гостиницы, место модное - вид на город, еда разнообразная и на высоком уровне. Обслуживание на отлично, цены выше чем в городе, много иностранцев которые проживают в отеле."
"2019-04-19","nl","OTHER","Uitstekend","9593555","2019-04","FRIENDS","5","Prachtige locatie met een mooi uitzicht over de stad Chisinau. Uitstekende gerechten van topklasse. Prijsklasse is erg hoog voor Moldavië! Bediening is perfect. Ook de keuze is overweldigend! Uitstekend!"
"2021-09-03","ru","OTHER","Прекрасная молдавская кухня в современном оформлении","21041974","2021-06","NONE","5","@fuior_gourmet - относительно новый ресторан в центре Кишинёва, рядом со сквером кафедрального собора. Современный, но с традиционной кухней. Для удобства тех, кому надо срочно перепробовать всю национальную кухню, тут сеты - вот мы и взяли два и добавили немного сверху. 
Вино в меню только бутылками, по бокалам только три-четыре позиции, озвученные официантом, но чего уж, #wheninrome осилим и бутылку. 
Холодец из кролика - плотный, не пресный. Интересная деталь в соусе - зерна кориандра. Рулеты из перцев с сыром - довольно знакомые для нас из Кавказской кухни. 
Гивеч - родственник аджапсандала, с сильным дымным привкусом с мангала. 
Опять испробовали заму, на этот раз с перепелкой, а не с курицей - тут подают со сметаной и мелкими маринованными острыми перцами. Острота совсем умеренная, как и кислота супа нестрашная.
Плацинты - слоеные лепёшки с начинкой, к каждому сету по одной на выбор (и можно взять сладкую как десерт, но это не наш метод), взяли как горячую закуску одну с брынзой и одну со шпинатом. 
Гóлубцы тут двух видов - капустные и виноградные, оба очень компактные и замечательно тонкие оболочкой. В начинке больше риса, чем мяса, но замечательно приправленного, никакой пресности. 
Мититеи #чтовытетямнететити - колбаски, которые отваривают, затем доводят на гриле, что якобы залог их сочности - не знаю, насколько технология повлияла, но и правда сочные, брызжущие практически при разрезании. 
На десерт бабка негра (ну что я могу поделать, если по-румынски «негру» - это «чёрный») Традиционный десерт, который делают из белых ингредиентов, а результат чёрный. Фундук и варенье из зелёных грецких орехов я, понятное дело, сдвинул на половину @kudryaka, а слегка тянущийся упругий бисквит съел. 
Хороший ресторан для ознакомления с Молдавской кухней в современном интерьере с оммажами традиционному стилю."
