"publishedDate","lang","publishedPlatform","title","locationId","travelDate","tripType","rating","text"
"2019-05-20","ru","OTHER","Отличное место для хорошего вечера","3643106","2019-04","FRIENDS","4","Отличное тихое место в центре Кишинева. 
Что отдельно хотел бы выделить:

- Хорошая кухня (мясо это отдельная тема)
- Богатая винная и коктейльная карта 
- Хорошие кальяны
- Относительно спокойное место
- Есть летняя терраса

Цены выше среднего, но поверьте - оно того стоит"
"2019-04-30","ru","MOBILE","Вечером ","3643106","2019-04","FAMILY","5","Шикарная обстановка. Внимательные официанты. Вкусные блюда. Демократичный счёт. Разнообразное меню. Отличное настроение. Спасибо, Дмитрий"
"2019-02-04","en","OTHER","Great service and great food!","3643106","2019-02","FRIENDS","5","We have been here quite often since it's close to our place (a walk up from Lacul Valea Morilor) and all of the food has been amazing. They have great grilled meat, salads, and fish. They also have a nice kids menu. The service staff is always so nice and accommodating for families. We also recently went there for a private birthday party and they did a fantastic job with the food and service."
"2019-01-17","ru","OTHER","Хорошая восточная кухня и отличное обслуживание","3643106","2019-01","FAMILY","5","Одно из ""модных"" заведений кишинева, хотя находится чуть в стороне от центра, ближе к парковой зоне.
Уровень цен выше среднего для города, публика соответствующая, видно по парковке машин у заведения :)
Готовят вкусно, очень рекомендую мясные блюда и аджарские хачепури (сыра не жалеют, тесто отличное, лучшее в городе на мой взгляд). Хороший набор вин и фирменных чаев.
За все посещения в течении нескольких лет редко меняются лица официантов, при чем уровень обслуживания остается высокий и при каких либо дополнительных пожелания по нестандартному заказу, всегда стараются помочь.
Зимой рекомендую закрытую терассу с камином на дровах. Уютная атмосфера для ужина."
"2019-01-15","en","OTHER","Nice menu and great location outside the park","3643106","2018-12","NONE","3","Good variety in the menu, great wine list but very poor cocktail program. Service can be quite slow. "
"2019-01-04","it","MOBILE","Scadente, vale poco","3643106","2019-01","FRIENDS","2","Questo ristorante nel centro di Chisinau sempre aperti 24 ore non vale in realtà minimamente le recensioni pubblicate.
Appena arrivati ci siamo stati.
Location pretenziosa ma priva di fondamentali dettagli di stile.
Con il freddo che faceva fuori ci hanno messo in una sala di legno dell'odore strano con il camino spento. 
Cameriere scostante e disattento.
Piatti di carne (ed abbiamo preteso solo vitello) qualitativamente sotto la media.
Ed alla fine conto salato ove, messi i soldi sul tavolo, il cameriere nel frattempo svegliatosi ci ha rimproverato che mancava la mancia...
Così gli abbiamo dato 10 euro.
Si convertira' all'europea educazione? Dubitiamo...."
"2018-11-06","en","MOBILE","Amazing Restaurant","3643106","2018-11","BUSINESS","5","This restaurant is easily the best location in the city to have grilled meats, especially Shashlik.  Wonderful ambiance and atmosphere, and great service.  Prices were absolutely reasonable given the food quality.  This is a must visit place in Chisinau!"
"2018-10-24","en","MOBILE","Good location and terrace, overrated ","3643106","2018-10","FRIENDS","3","Very good location at the edge of the lake park with astonishing cars parked outside the restaurant much above Moldova standard. Inside no special reason for such clientele. Food reasonable but nothing special, service slow, prices higher than should be according to offer. "
"2018-10-22","sv","OTHER","Smart grillrestaurang","3643106","2018-10","FRIENDS","4","La Sarkis är en smart och modernt inredd grillrestaurang. Trevlig personal. Intressant menu och en mycket bra vinlista. Kött är deras specialiteter. Vällagat och gott."
"2018-10-16","es","MOBILE","Sitio correcto y buena comida! ","3643106","2018-10","FAMILY","3","Pillamos un buen día así que comimos en la terraza. El restaurante está al lado de un parque muy bonito así que la ubicación es perfecta. En cuanto a la comida bastante correcto todo. Los entrantes ya los podéis ver en la foto. Nosotros pedimos salmon y quedamos contentos. "
"2018-10-10","en","OTHER","Good Food but Questionable Billing Practices","3643106","2018-09","COUPLES","3","So, the food is very good and the ambience is very nice. The service is okay, a bit on the surly side. Questionable billing practices though - like charging for the lemon in your water that you didn't ask for...seriously?"
"2018-10-10","en","MOBILE","Awful service and attitude","3643106","2018-10","COUPLES","2","The evening was ruined by awful service!! . Waiter repeated our order about drinks ""cappuccino and Americano with milk , okay"" , but he brought us other drinks anyway... We got Americano without milk, and disgusting latte instead of ordered cappuccino. Then we asked him to come after few minutes as we choose the wine, he came in 15+ minutes.... Then, hookah server took our order, and we were waiting 45 minutes, 2 other tables where clients came after us - already got their hookas , but we hadn't. There were not  too many people in the restaurant... We reminded our waiter about our hookah, and only after that we got our hookah in 15 minutes... Clearly that hookah guy just forgot about our order! He came to fix coals of hookah only 1 time after 1 hour when we have already asked for the bill, and he didn't even wait to ask the feedback of the first draw, in all restaurants hookah servers always do that. 
Not to mention that the whole place is very overpriced the attitude of the servers is disgusting."
"2024-09-20","es","MOBILE","Obligado","1089531","2024-09","COUPLES","5","Uno de los pocos restaurantes locales moderno con platos locales . Muy buen precio, se puede comer por unos 8-9€.
Atención correcta y hay wifi.  Sitio agradable para poder probar comida local. Está en el centro de la ciudad cerca de la catedral."
"2024-09-19","en","OTHER","Impressive solyanka and cherry placinte","1089531","2024-09","SOLO","5","Impressive Solyanka, served with a separate hot chili pepper and sour cream. Balanced taste, good cooking.

Also the cherry placinte (desert) is the hit and must-have"
"2024-09-18","en","OTHER","Rude staff","1089531","2024-09","FAMILY","2","Food is tasty but staff is very rude. Worth to try if u want traditional food. Otherwise avoid this place. There is better ones in"
"2024-09-12","en","OTHER","LOVELY PLACE AND HEALTHY TRADITIONAL CUISINE","1089531","2024-09","SOLO","5","It's the best gastronomic experience I've had in Chisinau! Attentive, kind and professional staff, fast delivery service at hotel and very lovely traditional atmosphere accompanied with national music. Greatly recommended!!!"
"2024-09-11","ru","MOBILE","Последний визит был просто ужасен.","1089531","2024-09","COUPLES","3","«La Plăcinte», в целом является неплохим заведением традиционной молдавской кухни. Но настоятельно не рекомендую заказывать стейк из свиной рульки с картофелем. Это ужасное блюдо, приготовленное из ужасных продуктов. В остальном рекомендую."
"2024-09-10","it","OTHER","Il nostro posto preferito","1089531","2024-09","COUPLES","5","Abbiamo girato un po' di ristoranti e abbiamo capito che la placinta lo sarà il nostro preferito.la prima cosa;locale è pulito, accogliente, moderno!cibo ottimo 👍🏼 buonissimo tutto e tutte le volte che ci siamo andati era sempre al altezza! servizio giusto(i camerieri sono presenti ma non noisi)
Ci piace ci piace ci piace!
SUPER CONSIGLIATO!!!"
"2024-08-07","en","OTHER","A nice restaurant","1089531","2024-08","FRIENDS","5","It was a very nice and with very good restaurant.  I heard about this restaurant before, but I could not imagine that the food was so delicious. I recommand you to go there and try their food!"
"2024-07-08","it","MOBILE","OTTIMO RISTORANTE ","1089531","2024-05","FAMILY","5","Ottimo ristorante e ottimi i piatti! 

Meravigliosi gli arredi.

Siamo stati in diverse sedi della catena sparse per la città

Prezzo buono

Le plăcinte sono buone! "
"2024-06-01","en","MOBILE","Amazing and delicious","1089531","2024-06","FAMILY","5","I have ordered very late, the woman who answered my call was very nice to still send my order to the hotel. The food arrived under 1 hour, warm and delicious. La Plăcinte is a must try when visiting Chisinau."
"2024-05-13","en","OTHER","Great value Moldovan specialties","1089531","2024-04","COUPLES","5","Great value place to try Moldovan specialities. Extensive menu with lots of interesting dishes. Opens late, so ideal for food after a night out."
"2024-04-28","de","MOBILE","Sehr zu empfehlen!!!","1089531","2024-04","COUPLES","5","Leckeres einheimisches  Essen, sehr freundliche Bedienung, gute Portionen und gute Preisleistung.
Die traditionelle Einrichtung hat viel Geschmack"
"2024-04-27","en","MOBILE","Beef or lamb?","1089531","2024-04","SOLO","3","The restaurant is nice, they use fresh and good ingredients. 
My only problem here was they do not have any beef or lamb dishes, which is a big downfall for me since I do not eat pork.
"
"2024-04-14","fr","MOBILE","Excellent dans l’hypercentre","1089531","2024-04","SOLO","5","Ce grand restaurant du centre du centre de Chisinau propose d’excellentes spécialités moldaves à  un prix très modique dans un cadre grand clair propre.
La cuisine moldave , partage avec la cuisine roumaine quasiment les mêmes spécialités et ici elles ont les mêmes saveurs que celles que l’on peut manger dans les familles. 
Service efficace, on se régale !"
"2024-03-15","ru","MOBILE","Вкусная национальная кухня ","1089531","2024-03","COUPLES","5","Вкусно,  дёшево. Быстрое  обслуживание.  Красивый интерьер.  Есть  меню на русском  языке  . Однозначно  рекомендую к посещению. "
"2024-02-12","en","MOBILE","Nice local food","1089531","2024-02","SOLO","4","Very good local Moldovan food in the center of Chișinău with very reasonable prices! Atmosphere not that cozy but it’s a very decent choice!"
"2024-02-05","it","MOBILE","Locale Ottimo","1089531","2024-02","SOLO","5","Locale molto accogliente e molto pulito, il personale molto educato, disponibile e parla inglese, cucina con piatti tipici moldavi, prezzi molto bassi per cittadini UE"
"2023-08-09","en","OTHER","Low service","1089531","2023-08","FAMILY","1","Bad experience at low level...

 I always visited the restaurant ""La Plăcinte"" for our Moldovian cuisine, because they have a varied assortment of delicious dishes.  On 07.08.2023 we had dinner at the restaurant at the address Chisinau Șos. Hâncești, 58 with my family, there were 4 adults people, the order was made at 8:00 p.m., the waitress brought us the dishes one by one, but that was not problem, shocked me  the attitude of the employers when at 10:15 p.m. they turned off the light outside, because we were on the terrace in the terrible hot weather preferring sit outside in the coolness of the evening, and the worst part was that they didn't even warn us that the place was closing.  At 21.50 the waitress who served us approached to us and asked  if we wanted to order anything else, because the kitchen is closing - the kitchen not the restaurant( that mean spending more money to do ordering is OK and after 10 p.m hearing the restaurant is close)we said no, thank you, and aftre at 10.20 p.m. the light goes out on the terrace,  we sit in the dark with two other tables they  were having dinner like us.  We were all quiet, calm, there was no noise so that you could say that's why they turned off the light, we had taken a 1-liter jug ​​of wine for four adults during dinner, so you can understand our state... at the table next to us we ordered  it was brought to them at 9:40 p.m., that means the people didn't even manage to eat normally and we were simply ""run away"" from the table.  The husband asked manager to explain this situation,the waitress told that at this time all the ""managers"" were sleeping, when he asked for the complaint form, they told him that they didn't know where it is and only after the husband replied that his gonna  call  the police then quickly the waitress returned and took the form  where he knew it was... I was shocked with a very bitter hust by the attitude of the staff, in this chapter, Moldovans still have a lot to learn about properly service.  I know, the staff was tired after 12 hours of work,those who don't work don't understand, but if you work in the service field, you really have to know good manners.  I do not do address this mistake to the staff who serve, but to the administration, to the owner of this restaurant gallery, to see where the gaps and mistakes are in the business, because if people come and spend their money at your restaurant, that means they bring you money too  in your business and if you want good recommendations on sites other than ""TripAdvisor"", it means that you have to work and go up to date with everything.  Yes, I can say, abroad it is not like that, the thing with the ""last"" customer is in force and it is correct, because the owner knows that the development of the business depends on the customers.
 Thank you, however, to the kitchen and the head chef for always being at the level and I want a responsiveness and explanation from the local administration.
P.S. I have attached the pictures of the darkness we stayed there."
"2023-08-06","en","MOBILE","Fabulous","1089531","2023-08","SOLO","5","I am only here on a short stay, and have generally found Chisinau absurdly expensive for some things (like wine tasting) and often restaurants. This is an exception. The food is exceptional and very well priced. The Physillis tea/juice (with cinnamon, orange and mint) is to die for. No hesitation in giving 5 stars."
"2023-07-20","en","MOBILE","Even kids adore this place for taste","1089531","2023-07","FAMILY","5","It’s the best place in Chişinău! 
Good service and wonderful dishes for reasonable prices. 
We ordered soup, kotlets with purée, meat with mamaljuga, fish, lemonades, cakes “platcinda” with cherry… everything was delicious."
"2023-07-18","en","OTHER","worth a try for a good meal","1089531","2023-07","SOLO","5","traditional cuisine and place, very good meals, I tried traditional sour soup, full of vegetables, cabbage ad veal meat, and tasty home made pelmens, good price "
"2024-08-28","ru","OTHER","Идеальная кухня! Очень вкусно!","9729405","2024-08","BUSINESS","5","Были здесь на банкете с партнерами. Обсуживание безупречное, кухня вкуснейшая! Заказывала утку - и это лучшая утка, которую я когда-либо пробовала. Нейжнейшее мясо, приготовленное до идеального состояния! Сладости - нечно невероятное, каждая из них - отдельный шедевр! Благодарность персоналу ресторана за приятную атмосферу, идеальный сервис, а шеф-повару низкий поклон за высочайшее мастерство!"
"2024-04-27","en","MOBILE","Very nice","9729405","2024-04","SOLO","4","Service, presentation and ambience was lovely. Only one thing I would have enjoyed better was to have more steak varieties.
"
"2023-10-10","en","MOBILE","Great:)","9729405","2023-10","COUPLES","5","It is a cozy restaurant with a helpful and friendly staff
The dishes are very good, tasty and lovely arranged in plates 
We had a Moldavian wine, very good in combination with food"
"2023-08-20","ru","OTHER","Прекрасная кухня, приветливый персонал.","9729405","2023-08","FAMILY","5","Отлично подходит для празднования знаменательных дат, или просто романтического ужина. Понравились и основные блюда и десерт."
"2023-07-13","en","MOBILE","Amazing food creations","9729405","2023-07","FAMILY","5","This is one of the best restaurants in Moldova, the combination of food items is reminiscent to a Michelin star restaurant. Everyone is very attentive and warm. We visit it every few weeks."
"2023-02-18","ru","MOBILE","Были на 14 февраля 2023 года❤️","9729405","2023-02","FAMILY","5","Ушли вкусно поужинав и с хорошими эмоциями . Заказывали мясо, рыбу и десерты, кухня супер . Официанты искреннии и приятные ребята . Спасибо ❤️"
"2022-09-04","ru","MOBILE","Всем рекомендую!!!","9729405","2022-09","COUPLES","5","Хороший ресторан, много раз бывал, отличное ме для гурманов, все очень  вкусно, сервис на высоте, лучший в городе Кишенев, хорошие кальяны, всем рекомендую!!!"
"2022-07-14","ru","MOBILE","Любимый ресторан","9729405","2022-06","COUPLES","5","Любимый ресторан в городе! Отличная атмосфера, приветливый персонал и вкусные блюда и коктейли (гарниры, салаты, мясо и рыба). Вообщем действительно нравится всё, главное чтоб ничего не меняли😊
P.S. Тартар с телятиной стал хуже🥲"
"2021-11-06","ru","MOBILE","Возможно сейчас иначе.","9729405","2020-12","COUPLES","4","Все было бы хорошо, если не одно малюсенькое но! 
Мы не забронировали столик и администратор задала глупый вопрос: вы успеете поесть за час? На что ей был адресован не менее глупый вопрос : «а вы приготовить?
В пустом зале нас посадили за самый маленький столик на проходняке. 
Еды была приготовлена относительно быстро, поели и ушли. Не очень гостеприимно и как то возвращаться не хочется, хотя, администратор, как и политика заведения могли измениться."
"2020-07-27","ru","MOBILE","Отравились салатом с прошутто и мёдом.","9729405","2019-09","FAMILY","1","Ходили поужинать с парнем и родителями. Атмосфера и сервис на высоте. Чего не сказать про блюда... Мы заказали с парнем салат с прошутто и медом, кролика и сок. Алкоголь не пили, родители пили коньяк, поэтому их пронесло от жёсткого поноса и ночи блевания, а нас вот не пронесло...спасибо за ужасную ночь! 
Испортилось впечатление обо всём!!"
"2020-02-27","ru","MOBILE","Хороший ресторан ,очень красивая","9729405","2020-02","NONE","4","Хороший ресторан ,очень красивая подача и качественная пища . Однозначно рекомендую , спасибо Вам за атмосферу ."
"2019-12-16","ru","MOBILE","Выходные в Кишинёве","9729405","2019-12","FRIENDS","5","Очень понравилось : отличный интерьер , стильно украшенный к Рождеству , грамотный персонал, изумительно вкусная еда , красивая подача . Всё сложилось"
"2019-12-11","tr","MOBILE","Kişinevde gurme tecrübe ","9729405","2019-12","NONE","5","Kişinevde gurme tatlar tecrübe edebileceğiniz, güzel bir mekan. Özel terbiyeli tavuk ve balık seçenekleri oldukça iyiydi"
"2019-11-25","en","MOBILE","Purcari experience","9729405","2019-11","FRIENDS","5","I had a dinner here with some friends. The style is modern and elegant. The quality of the food was ok. I had some salmon with green rice as a main course, drinking the wonderful purcari wine while eating. It deserves to be visited while in Chișinău..."
"2019-11-25","ru","MOBILE","Рекомендую ","9729405","2019-11","NONE","5","Отличный ресторан: местоположение, интерьер, стиль и вид.
Каждый раз еда великолепна: вкусная, свежая и красиво подано. 
Вернусь с большим удовольствием!"
"2019-11-07","en","MOBILE","My favorite place ","9729405","2019-11","FRIENDS","5","THE BEST ♥️
The best breakfast in town 
You must try papanasi and steak
The staff is very friendly 
Perfect place for breakfast, lunch and dinner🥰🥰🥰"
"2019-08-28","ru","MOBILE","Протухшее яйцо и мясо!!!!! УЖАССССС","9729405","2019-08","FRIENDS","1","Посетила ресторан ОШО  И перенесли они нам протухший яйцо и мясо!!! Ужас мы с друзья ми и не поняли что произошло, никому не посоветую !!!! Ужассс"
"2019-08-20","ru","MOBILE","Великолепное заведение","9729405","2019-08","FRIENDS","5","Люблю этот ресторан. Очень приятная атмосфера. Замечательные хозяева, которые вложили сердце в своё дело. Кухня великолепная. Всегда чисто, красиво и достойно. "
"2019-08-05","ru","MOBILE","Топ в Кишиневе","9729405","2019-08","FRIENDS","5","Лучший ресторан в городе. Очень вкусно, отменный сервис. 
Брали салаты, рыбу, медальоны))
Красиво. Нашему малому ребёнку принесли как комплимент смузи безумно вкусный, потому что плакал.
Вернёмся)"
"2019-07-29","pl","MOBILE","Wow","9729405","2019-07","COUPLES","5","Cudowne miejsce, obłędna kuchnia. Polecam surowego łososia z arbuzem i pomidorami, pastę kawiorową z ciemnym chlebem, krewetki, ośmiorniczki z pieczonymi ziemniakami i pstrąga w soli, cudowny deser i regionalne wino musujące. Taka kolacja koszt 150 euro na 2 odoby"
"2024-08-22","en","MOBILE","Amazing!","2261775","2024-08","COUPLES","5","I came here with my girlfriend and had an amazing experience!
Overall, I would compare it to Michelin Star Restaurant from western Europe. The location is chic, the service was spot on and the food was great!
The waiter described the dishes and wines that we were interested in, made sure to ask how everything was and also spoke 3 languages.
I have no words to describe the food... simply amazing! Smell, texture, taste and perfectly balanced.
I really recommend this place!"
"2024-08-17","en","MOBILE","Great place for dinner","2261775","2024-08","FAMILY","5","Found this restaurant thanks to TripAdvisor. As a result, the whole family is delighted with the dinner. The children really liked the chicken kebab and steak mignon. We also enjoyed burata with tomatoes and polenta. Very welcoming and friendly staff. Overall the service is at a high level. I definitely recommend it."
"2024-08-08","de","MOBILE","Schöne Location, mittelmäßiges Essen","2261775","2024-08","FRIENDS","3","Schön zu sitzen.  Wir mussten sehr lange auf unser Essen warten.  Mein Fleisch war leider totgebraten.  Preislich über dem Durchschnitt."
"2024-08-07","de","MOBILE","Ausbaufähig","2261775","2024-08","FRIENDS","2","Die Mitarbeiter sind sehr hilfsbereit. Das Essen hat sehr lange gedauert, das Schweinefleisch war zu zäh, die Pommes zu hell."
"2024-06-12","en","OTHER","Good food, bad hygiene","2261775","2024-06","SOLO","2","Food is good, restaurant is stylish and looking fine. However, toilet is so dirty. Even after commenting on it for 3 times, they did not clean it. Despite the fact that i am a customer that spend 2 weeks eating there everyday.

It absolutely does not life up to the rest of the restaurant, making the overall experience disappointing."
