"publishedDate","lang","publishedPlatform","title","locationId","travelDate","tripType","rating","text"
"2020-11-20","ru","MOBILE","Саперави","12794044","2020-11","FAMILY","4","Душевное место

777533547
Ресторан с Грузинской душой:оформление, еда, обслуживание- все было на уровне, но хочу обратить внимание и менеджеру и тем кто пожелает провести спокойный вечер за приятной беседой с людьми, которых собрали за своим столом, и вкусной едой, на других посетителей ресторана, которые совсем не считаются с присутствием других клиентов . Когда делаете резервацию столов: 2 мероприятия в одном зале РЯДОМ-это ОЧЕНЬ МНОГО!!!!!!!!!! Этот факт на половину испортил шарм посещения вашего заведения! Жаль! Мог быть душевный вечер, но из-за компании из 9 женщин( которые в условия Ковид-а! вряд-ли родственницы!), которые вели себя ОЧЕНЬ...НЕУВАЖИТЕЛЬНО!!!!!!- этот вечер был испорчен. К Моему великому сожалению!"
"2020-09-04","en","OTHER","Service Problematic","12794044","2020-09","COUPLES","1","Well located restaurant, nice terasse and quite tasty food (even if a bit expensive for what it is).

Service killed the whole experience with us wanting to leave as soon as possible. 

As one of us is allergic to smoke and our table on the terasse was close to a large group with 6-7 people smoking while eating, we first kindly asked if it is allowed to smoke here, and informed that yes, we kindly asked if it is possible to get another table once one would be free. The waiter snubbingly told us we should be glad we had a table at all, and no, no move was possible. This quite aloof and unfriendly attitude stayed throughout the experience. When asked (again kindly) for a fiscal receipt the waiter acted as we asked him to climb Mount Everest but brought it without a word (no ""please here you are"" or similar). Of course not a lei for tip. And we will for sure not come back. 

It is a pity as food is quite delicious and training those boys and girls to like their job and understand that they are there to make the guests' experience a nice one, not vice versa, should be possible. Please hire better and more dedicated staff. Not some beefy guys that would rather be somewhere else and who behave like they do you a huge favour simply be existing (they don't). 

Like this serious clients will stop coming. There are many other more friendly places in Chisinau... Saperavi - beware."
"2020-01-21","ru","OTHER","Мальчишник , мальчики за пятьдесят резвились !!!!!!!!!!!!!!","12794044","2019-12","NONE","5","Обязательно вернусь ,и тем кто здесь не был рекомендую побывать, Кухня вино обслуживание все на уровне,"
"2019-11-20","en","OTHER","Excellent authentic Georgian food and and wine with great service","12794044","2019-11","NONE","5","We were a group of twelve which had a wide selection of Georgian food, as well as excellent wine.  The atmosphere in the restaurant was really nice and friendly.  The service was very excellent and all the food was really well presented and tasty.  Highly recommended to all lovers of Georgian food and also for those who haven't tasted it before."
"2019-09-09","iw","MOBILE","אכלנו  טוב ","12794044","2019-09","COUPLES","5","מסעדה ממוקמת קצת רחוק ממרכז העיר .
הגענו  עם מונית , אוכל נהדר שרות אדיב 
האוכל הגיע מאד מהר ומאד טעים , ממש לא יקר
כדאי  לבוא  לאכול פה . "
"2019-07-21","ru","MOBILE","Отличное место для отдыха! ","12794044","2019-07","FRIENDS","5","Вкусно и по-домашнему уютно! Посещаем не первый раз, всегда все на высшем уровне, приятная атмосфера и вежливый персонал оставляют только приятные впечатления. Рекомендую к посещению, шашлык и хачапури по аджарски бесподобны!! "
"2019-07-16","ru","MOBILE","Отлично","12794044","2019-07","FAMILY","5","Рекомендую этот ресторан к посещению, вкусная грузинская еда, обслуживание, интерьер. Регулярно посещаем"
"2019-07-13","en","OTHER","Great food!","12794044","2019-06","FRIENDS","5","I went there with a small group - there were 5 of us. I totally enjoyed the fish and vegetarian dishes! The desert was great! Totally recommending it."
"2019-06-29","en","MOBILE","Lovely place. Authentic cuisine ","12794044","2019-06","FRIENDS","5","Been there a few times in June. The only bad thing is my stomach which is not big enough to fit that much food as I’ve ordered 😃
My friends who live there for years didn’t even know this gem exists in their city!"
"2019-06-23","ru","MOBILE","Хороший ресторан","12794044","2019-06","FRIENDS","5","Хороший и атмосферный ресторан. Вкусное мясо, интересные блюда. 
Один минус - нельзя заказать грузинское вино на бокалы, только бутылкой. В чем проблема - не понимаю; при том что у соседнего столика был такой же вопрос. 
"
"2019-06-22","en","OTHER","Worth driving to all the way from center of Chisinau!","12794044","2019-06","BUSINESS","5","The only down side is that there's so much to chose from.. and you can't possibly eat all you want to. The food is amazing, totally amazing.
After dinner, make sure you take a walk in the family friendly park right outside, and buy a coffee or drink from the street kitchen dude just outside. He's very popular, so you may need to wait in line a little while. But where's your hurry?
Locally the restaurant is mid-range. However, seeing as this is a non-costly country, this mid-price is considered lower than mid in central Europe."
"2024-10-04","en","MOBILE","A very good but not excellent meal.","23474553","2024-10","SOLO","4","This was without doubt a very good meal. The duck leg melted in the mouth and the dish was tasty. The asparagus could have done with another minute of cooking. The red wine was good but served too cold which was not good. I had to ask for my glass to be refilled - why not just leave the bottle on the table. Across from me was a group of three politicians whose wine was decanted - why was my wine not decanted? The dessert was very pleasant, no complaints - but it was far from memorable."
"2024-09-19","en","OTHER","Astonishing Salad with shrimps","23474553","2024-09","SOLO","5","offers one of the World's best salads!

Salad with shrimps...

Served on mix of chuka and stracciatella, with strawberry or raspberry (depending on the season), schrimps and what I thought was mozarella.   

Ideal taste mixture.... Perfect"
"2024-08-22","en","MOBILE","Excellent food and great ambience.","23474553","2024-08","FRIENDS","5","Excellent food, great services, pleasant ambience. We saw the reviews on net and for this reason we’re the main reason for our visit here."
"2024-08-09","en","OTHER","One of the best restaurants in Chisinau","23474553","2024-08","COUPLES","5","This is one of the consistently BEST restaurants in Chisinau.  The food is both amazingly delicious and creative!  Most important (and the reason most people eat out) is that the service is fantastic.  Our server, George, was wonderful and highly professional.  He also supported our intent is speaking in Romanian with great tolerance and support.  We cannot praise him enough for being so highly professional in our service. Bravo!"
"2024-07-13","en","MOBILE","One of the best restaurant from Rep. Moldavia and Romania","23474553","2024-07","FAMILY","5","Excellent service and absolutely fabulous food. The restaurant is located at the Thomas Albert hotel but separated by the hotel in a verry nice area. Highly recommended !!!"
"2024-07-04","ru","MOBILE","Номер один в Кишиневе!","23474553","2024-07","COUPLES","5","Великолепное место с прекрасным сервисом и вкуснейший кухней. 
Респект дизайнерам, поварам и официантам! Лучший ресторан Кишинева!
С нетерпением ждём новых встреч!"
"2024-06-30","fr","MOBILE","The restaurant ","23474553","2024-06","COUPLES","5","Une merveille 
Décors soft
Plats magnifiques en visuel et en goût
C'est L'adresse à Chisinau.
Diversité de plats de goût et une présentation précise, agréable 
Un grand bravo "
"2024-06-10","en","OTHER","Great experience","23474553","2024-06","SOLO","5","Beautiful environment. Great staff . Great service and last but not least , excellent food ! A must be if you pass by Chişinău 
Great experience"
"2024-02-28","en","MOBILE","Cozy and good!","23474553","2024-02","FAMILY","4","It is a nice restaurant into a hotel, but it was very good 
The waiter was very polite and helpful, because we didn’t want what do we want to eat so… we chose his recommendations and was great for us 
We discovered some good wines here"
"2024-01-31","ru","OTHER","Супер","23474553","2024-01","FRIENDS","5","Превосходная еда,отличная винная карта,прекрасное обслуживание и уютная атмосфера!Заведение где кайфуешь от всего)"
"2023-12-21","ru","MOBILE","Потрясающе ","23474553","2023-12","COUPLES","5","Вкусная кухня, отличное вино, очень внимательный персонал. Приятная атмосфера, лучшая идея для правильного завершения дня - посетить этот ресторан."
"2023-12-04","en","OTHER","Very nice indeed!","23474553","2023-11","SOLO","5","A recommendation by my hotel's reception manager guided me to Divus as it was extremely close by. It doesn't look much from the outside because all you can see are a few steps leading to a door directly underneath the Thomas Albert Hotel. From the photos on this site you can see that once inside it is nicely furnished  

The food was simply great and I certainly did not expect the quality of the ingrediants used and the presentation of what was served to me. Service was on point, but my visit did not coincide with the busy period.

To start, the liver parfait was especially good, so much so that I ordered a 2nd one for take out to my room later. Main course was the warm salad with some extremely tender beef. Once again, a most pleasant surprise to the taste buds. 

For what this cost - about a 3rd of what I would expect to pay at home - I think this was an excellent dining experience, and one I very much hope to repeat sometime soon"
"2023-11-14","en","MOBILE","Great restaurant with tasty food","23474553","2023-11","COUPLES","5","Great food. We stayed at the hotel connected to the restaurant and had a take away dinner from the restaurant. The food taste v good and it was quick, about 20mins wait and we can rest in the room. Convenient for hotel guest. Thanks! Pls try if you are nearby"
"2023-10-01","en","MOBILE","Great experience","23474553","2023-09","COUPLES","5","Amazing experience! Food, service ( our waiter, Vlad, was the best- great recommendation from him), wine, relaxed atmosphere, great decor… everything perfect! Thank you"
"2023-09-29","en","OTHER","Tasty 😋 ","23474553","2023-09","FRIENDS","5","Restaurant has delicious and fantastic food, quality drinks. The steaks are the best in town! And the atmosphere is great to! Come and visiting this restaurant, you will not regret it!"
"2023-09-26","en","MOBILE","Freedom wine","23474553","2023-09","BUSINESS","4","Had dinner at Divus with colleagues. The restaurant has nice indoor and outdoor seating. The menu has options for all tastes. The warm beef salad was delicious. We had Freedom wine, which was a nice theme. Good place!"
"2023-04-29","en","MOBILE","Great experience","23474553","2023-04","BUSINESS","5","Wines and all food were great. Service and cleanliness were very satisfactory. Definitely worth a try. Here should be your first choice in Chisinau"
"2023-04-22","ru","OTHER","Гастрономический оргазм ","23474553","2023-04","FRIENDS","5","Шикарное место, с великолепной кухней.еда была настолько гармонична между собой как будто сам Боженька её готовил, полный восторг 
Интерьер просто wow 
Сервис достойный 
  "
"2023-01-25","en","OTHER","Amazing","23474553","2023-01","COUPLES","5","Absolutely amazing food. One of the best restaurants I've ever been into. Review from a roumanian tourist"
"2022-12-07","ru","MOBILE","Для ценителей","23474553","2022-12","BUSINESS","5","Ресторан мишленовского уровня 👌🏻 подача, вкус, дизайн, обслуживание - порадовало все. Очень рекомендую к посещению ценителям авторской кухни"
"2024-09-29","ru","OTHER","The best","25270571","2024-09","FRIENDS","5","Самый Лучший официант, бегает как гепард, 8 рук как у осьминога,память в голове на 100гигов, вежливый как будто с Англии депортировали, обслужит как в 10-звезд. отеле, сделает все в лучшем виде еще и поет как соловей, танцует как майкл джексон в лучшие годы,чаевые желательно оставлять в евро, (станцует за 99)."
"2024-09-28","ru","OTHER","«Красота и восторг, тепло и уют»","25270571","2024-09","COUPLES","5","Заведение очень располагающее и атмосферное. Весьма интеллигентное отношение и обслуживание. Также хочется отметить приятную работу официантов, в особенности молодой девушки:))"
"2024-08-26","en","MOBILE","Living it up in Chisinau…","25270571","2024-07","BUSINESS","4","Lovely afternoon sitting outside drinking a local beer and a two light dishes, beetroot soup and salad. Great service and the sunshine was out…"
"2024-05-09","en","MOBILE","Charmat","25270571","2024-05","FAMILY","5","The Charmat restaurant left me with unforgettable impressions! The atmosphere of the place charms with its coziness and elegance. The service is top-notch - the staff is very attentive and friendly. The menu delighted with a variety of dishes, each of which is prepared with the highest skill. I especially want to mention their champagne, which truly deserves attention. I had a wonderful evening here and can confidently recommend Charmat as an excellent place for a romantic dinner or special event."
"2024-03-09","ru","OTHER","Советую","25270571","2024-02","FRIENDS","5","Очень классное место для того чтобы провести время с друзьями и близкими. Кухня оправдывает все ваши ожидания и коктейли от бармена заставляют вас пить их снова и снова. Очень советую💁🏻‍♂️"
"2024-02-16","ru","MOBILE","Вкусная кухня,приемлемое обслуживание,отличная музыка , интересный интерьер ,но есть вопросы к посадке,а в целом отлично","25270571","2024-02","FRIENDS","5","Все супер,низкие цены,вкусная кухня,хороший интерьер,странно что так мало людей, отличная музыка , правда есть вопросы к посадке,но за остальным 10/10"
"2023-09-29","ru","OTHER","Процветание","25270571","2023-09","SOLO","2","В первые побывала в это ресторане , но больше не вернусь :
Кухня не самая шикарная 
Обслуживание на 3 
Просеко шикарное 🤣"
"2023-03-02","en","OTHER","Great place in the center of Chisinau!","25270571","2023-02","NONE","4","I am very glad to visit this place! Perfect food, amazing drinks, delicious cocktails) Very pleasant and cozy atmosphere, and music, both bartenders and waiters are very friendly and pleasant, and hospitable. In general, there were very pleasant impressions, the only negative is the lack of parking, but I hope they will cope with this issue. I will definitely go back there."
"2023-02-27","ru","OTHER","Лучший на мой взгляд бар и ресторан в Кишиневе!","25270571","2023-02","FRIENDS","5","Очень приличное заведение, отмечали тут Новый год, всем понравилось, теперь завтрак, обед и ужин только в этом ресторане) 
На выходных заходим часто, всегда играют разные немалоизвестные диджеи, атмосфера безумная, тем более в сочетании с очень вкусным меню и напитками! 
Рекомендую попробовать Филе Миньон с картофелем и Средиземноморский Рыбный Суп)"
"2023-02-27","en","OTHER","One of the best place in KIV","25270571","2023-01","COUPLES","5","Visited few times with friends :
Great menu 5/5 
Music 5/5 
Atmosphere 100/100 👍

WILL COME BACK MORE !!!"
"2023-02-27","ru","MOBILE","Просекко бар","25270571","2023-02","COUPLES","5","Отличное место провести вечер в уютной атмосфере. Вкусные коктейли и изумительная кухня.
А вид из панорамных окон на ночной город завораживает👌"
"2023-02-27","ru","MOBILE","Побывал в Prosecco Bar, оценил ризотто с лобстером очень-очень вкусно, уютное место в самом центре города. Советую всем","25270571","2023-02","FRIENDS","5","Побывал в Prosecco Bar, оценил ризотто с лобстером очень-очень вкусно, уютное место в самом центре города. Советую всем посетить"
"2023-02-26","en","OTHER","Perfectly designed","25270571","2023-01","FRIENDS","5","A smooth place with the awesome tasty sea-food, mind-blowing cocktails and trained staff! 

We had a great time, will visit you soon again"
"2018-10-03","ru","MOBILE","Достойно!","3643106","2018-10","NONE","4","Хороший ресторан с тремя видами кухни, кавказ-Европа-местная, ужинал в этом заведении и мне все понравилось. Персонал, территория, интерьер все очень достойно!!! Обязательно посетите."
"2018-09-21","pl","MOBILE","Pysznie!!!","3643106","2018-09","FRIENDS","5","Dobra miejscowka 
bardzo dobre zroznicowane jedzenie.
pyszne szaszlyki z grilla..
Przyjemny ogrodek grillowy.
Polecam
"
"2018-09-09","da","OTHER","Et dejlig spisested","3643106","2018-08","COUPLES","5","Vi spiste på denne restaurant 5 aftener træk da vi var i Chisinau.
Og vi havde før spist et andet sted, men det var på ingen måde det samme.
La Sarkis har et meget varieret spisekort, og det er tydeligt, at der er kælet for maden.
Hvis du har muligheden så prøv deres ”Dishes in the Tandoor” - Du bliver ikke skuffet.
En rigtig god restaurant til fornuftige priser."
"2018-09-05","da","MOBILE","Fin oplevelse ","3643106","2018-09","COUPLES","4","Vi bestilte kun hver sin hovedret med hhv vand og ingefærte til, men fik alligevel en fin og udsøgt betjening af en flink tjener.
Min dorado fisk var virkelig god. Købte kartofler ved siden af. Steget med løg og champignon - det var virkelig lækkert og velsmagende. Min mand fik spaghetti bolognaise. Også det var lækkert og velsmagende. 
Retterne er dig meget små og der burde være salt og peber på bordene.
Derudover er der irriterende høj musik.. Noget af det var godt. De skruede kraftigt ned efter to opfordringer. Og hvis vi skal ned i småtingsafdelingen burde der være nogle pæne og gode servietter i stedet for de små lapper, man kan hive ud af en boks.
Lokalet er pænt indrettet. "
"2018-08-30","en","MOBILE","Surprisingly awesome ","3643106","2018-08","NONE","5","I just got to Moldova this afternoon. I checked in to the hotel and asked them where to go. They pointed me to La Sarkis and I walked here from the Regency Hotel. 

It’s near a park and i sat in the outdoor patio. A lot of beautiful people and attentive waiters. Food is probably expensive by Moldovan standards but for me the food and drinks were super cheap. Beer is like $2.50 and a Jack Daniel is like $4.50.  

I ordered the kebab with a side of rice and it was off the charts awesome. So happy I came here.  "
"2018-08-23","en","MOBILE","Bad cousin","3643106","2018-08","BUSINESS","1","Do NOT order lam in the oven there - they will serve you the donkey butt at the cost of truffles. Very clean nice place, but Terrible grossly overpriced cousin."
"2018-08-14","en","OTHER","Terrific European-style food in Chisinau","3643106","2018-08","BUSINESS","5","I'm in Chisinau for a month on a business trip, and have eaten at La Sarkis twice. The first time I had roast duck and the second time a mixed seafood dish -- shrimp, clams, mussels and octopus. Both meals were as good as you'd get in a good European restaurant. The dusk was just right -- moist but crisp. The seafood was even better. It was actually a bisque, and the sauce was light, sweet and scrumptious. La Sarkis sits in a green area, with lots of trees, so the atmosphere is relaxed. A lot of the patrons were dressed up, while a few were casual. Service was really good. When I caught a waiter or waitress's eye, they were at my table in a flash. And both meals were inexpensive, given the quality -- ranging between $15 and $25 for meal and drink. I'm sure I'll head back to La Sarkis a couple of more times before leaving Moldova."
"2018-07-11","es","MOBILE","Lujo a buen precio","3643106","2018-07","FRIENDS","4","Fuimos tres amigos españoles a la Sarkis recomendados por moldavos que nos decían que era un restaurante muy caro. Pues bien, nosotros pedimos: tres platos, dos postres y una botella de vino y nos salió en total por 50€, así que no es tan caro como lo pintan.
Se respira glamour: cochazos en la puerta, chicas guapas que van a tomar un cóctel, lugar limpio...
No le pongo la quinta Estrella porque el camarero se olvidó de traer mi plato y se lo tuvimos que recordar."
"2018-05-21","en","MOBILE","Great!!!!","3643106","2018-05","SOLO","5","Very cosy place, with a very nice staff and a great service!
Food was delicious!
I enjoyed mi lunch there! 
Prices were ok!"
"2018-05-20","en","MOBILE","Good food and location","3643106","2018-05","FRIENDS","4","Nice nice location, open space, località food are very good and list of wine and cocktail top. Suggested for Friends or for romantic meeting. I Will go back in a next trip to Chisinau. A+++"
"2021-10-03","en","MOBILE","Great views, nice ambience, poor service","9593555","2021-10","COUPLES","2","For the best restaurant (allegedly) in Chisinau, they need to work on their service.
Reserved a table for 2 and when we arrived were shown two bar stools at the smoking bar. No. Then when we sat at a real table there were 4 tables around us that stayed empty
Next, we saw the waiter 3 times
-order food and drink
- deliver food and drink
- bring bill to pay 

We wanted more drink and dessert but couldn’t attract anyone’s attention.  Nice views of the city and good live music but not recommending based on service - much basic training needed"
"2021-09-04","en","MOBILE","Fantastic evening","9593555","2021-09","SOLO","5","I generally avoid hotel bars but decided to go to Zaxi for drinks and dinner. The restaurant is beautiful with fantastic view, a really cool vibe and excellent staff. Certainly the best part of the Radisson Hotel, drinks were great and the food I ordered was delicious. Three cocktails and dinner came to just over 40 Euros which is good by international standards and this restaurant can certainly compete. A great option if you fancy a decent night out."
